{
  "$schema": "https://json-schema.org/draft/2020-12/schema",
  "title": "CBW MI ↔ GEO ↔ Deep Passport Binding",
  "description": "Records the single canonical binding between the Market Intelligence country×exchange cell (future canonical decision record), the existing frozen GEO passport (legacy production truth), and the Country×Exchange Deep Passport renderer. There must be exactly one binding per (exchangeId, countryCode) so no two competing availability truth records exist. This schema authorizes no data, ranking, page, route, or deploy change.",
  "type": "object",
  "additionalProperties": false,
  "required": [
    "bindingId",
    "exchangeId",
    "countryCode",
    "canonicalRecord",
    "miCellRef",
    "migrationPhase",
    "ownership",
    "eligibility",
    "productionStable",
    "ownerApproved",
    "reviewStatus"
  ],
  "properties": {
    "bindingId": {
      "type": "string",
      "description": "Stable id, e.g. bind-kz-bybit"
    },
    "exchangeId": { "type": "string" },
    "countryCode": { "type": "string", "minLength": 2, "maxLength": 2 },
    "canonicalRecord": {
      "description": "The single source of availability truth for this pair. MI cell is canonical going forward; GEO_LEGACY only while a pair has not yet migrated.",
      "enum": ["MI_CELL", "GEO_LEGACY"]
    },
    "miCellRef": {
      "type": "string",
      "description": "Reference to the exchange-market-cell (schemas/market-intelligence/exchange-market-cell.schema.json). Canonical normalized decision record."
    },
    "legacyGeoPassportRef": {
      "type": ["string", "null"],
      "description": "Reference to the existing frozen GEO passport (schemas/geo/exchange-geo-passport.schema.json) where one exists. Read-only input; never overwritten by this binding."
    },
    "deepPassportRef": {
      "type": ["string", "null"],
      "description": "Reference to the Deep Passport render record (schemas/country-exchange/country-exchange-deep-passport.schema.json). Consumer only; must NOT hold an independent availability record."
    },
    "migrationPhase": {
      "enum": [
        "MIGRATION_0",
        "MIGRATION_1",
        "MIGRATION_2",
        "MIGRATION_3",
        "MIGRATION_4",
        "MIGRATION_5",
        "MIGRATION_6",
        "MIGRATION_7"
      ],
      "description": "MIGRATION_0 docs/schemas · 1 read-only adapter · 2 shadow compare · 3 discrepancy report · 4 owner approval · 5 ranking integration · 6 noindex Deep Passport pilot · 7 production activation. No phase skips owner approval."
    },
    "ownership": {
      "type": "object",
      "additionalProperties": false,
      "description": "Which system OWNS each field. Exactly one owner per field — prevents two competing truth records.",
      "required": [
        "exchangeIdentity",
        "countryIdentity",
        "availability",
        "productStatuses",
        "registration",
        "kyc",
        "p2p",
        "localFiat",
        "fees",
        "restrictions",
        "evidence",
        "confidence",
        "freshness",
        "offerEligibility",
        "rankingEligibility",
        "ctaEligibility",
        "languagePresentation"
      ],
      "properties": {
        "exchangeIdentity": { "$ref": "#/$defs/owner" },
        "countryIdentity": { "$ref": "#/$defs/owner" },
        "availability": { "$ref": "#/$defs/owner" },
        "productStatuses": { "$ref": "#/$defs/owner" },
        "registration": { "$ref": "#/$defs/owner" },
        "kyc": { "$ref": "#/$defs/owner" },
        "p2p": { "$ref": "#/$defs/owner" },
        "localFiat": { "$ref": "#/$defs/owner" },
        "fees": { "$ref": "#/$defs/owner" },
        "restrictions": { "$ref": "#/$defs/owner" },
        "evidence": { "$ref": "#/$defs/owner" },
        "confidence": { "$ref": "#/$defs/owner" },
        "freshness": { "$ref": "#/$defs/owner" },
        "offerEligibility": { "$ref": "#/$defs/owner" },
        "rankingEligibility": { "$ref": "#/$defs/owner" },
        "ctaEligibility": { "$ref": "#/$defs/owner" },
        "languagePresentation": { "$ref": "#/$defs/owner" }
      }
    },
    "eligibility": {
      "type": "object",
      "additionalProperties": false,
      "description": "Separate eligibility fields. Availability, ranking, CTA and promo are distinct and never collapsed; affiliate value must never influence ranking.",
      "required": ["availability", "rankingEligibility", "ctaEligibility", "promoEligibility"],
      "properties": {
        "availability": {
          "enum": ["AVAILABLE", "AVAILABLE_WITH_LIMITS", "RESTRICTED", "UNAVAILABLE", "UNDER_REVIEW", "CONFLICTING", "UNKNOWN", "STALE"]
        },
        "rankingEligibility": { "type": "boolean" },
        "ctaEligibility": { "type": "boolean" },
        "promoEligibility": { "type": ["boolean", "null"] },
        "affiliateInfluencesRanking": {
          "const": false,
          "description": "Invariant: affiliate value never affects ranking."
        }
      }
    },
    "evidencePrecedence": {
      "type": "array",
      "description": "Ordered tiers, strongest first. Regulator/sanctions and official exchange/product/fee pages outrank news; community never establishes a critical claim alone.",
      "items": {
        "enum": ["REGULATOR_SANCTIONS", "EXCHANGE_TERMS_RESTRICTED_REGION", "OFFICIAL_PRODUCT_FEE", "BANKS_PAYMENT_RAILS", "NEWS", "COMMUNITY"]
      }
    },
    "conflictResolution": {
      "type": ["object", "null"],
      "additionalProperties": false,
      "description": "How a GEO-vs-MI or source-vs-source disagreement is handled. Never resolves toward the commercially convenient answer; never changes production automatically.",
      "properties": {
        "case": {
          "enum": [
            "GEO_AVAILABLE_MI_RESTRICTED",
            "OFFICIAL_SOURCES_DISAGREE",
            "GEO_EVIDENCE_FRESHER_THAN_MI",
            "MI_UNKNOWN",
            "LIVE_VERIFICATION_UNAVAILABLE"
          ]
        },
        "outcome": {
          "enum": ["HOLD_CONFLICTING", "PREFER_STRONGER_TIER", "PREFER_FRESHER_OFFICIAL", "KEEP_UNKNOWN", "OWNER_REVIEW_REQUIRED"]
        },
        "ctaSuppressed": { "type": "boolean" },
        "rankingSuppressed": { "type": "boolean" },
        "productionRouteUnchanged": {
          "const": true,
          "description": "Existing production route must remain stable during any conflict."
        },
        "notes": { "type": ["string", "null"] }
      }
    },
    "liveVerificationState": {
      "enum": ["LIVE_VERIFIED", "NOT_LIVE_VERIFIED", "NOT_APPLICABLE", "UNKNOWN"],
      "description": "NO-PROXY mode: proxy/VPN/live-IP bypass is never required; absence stays visible as NOT_LIVE_VERIFIED."
    },
    "productionStable": {
      "const": true,
      "description": "This binding never changes existing production behavior; existing GEO records and routes remain frozen until MIGRATION_7 owner approval."
    },
    "ownerApproved": { "type": "boolean" },
    "reviewStatus": {
      "enum": ["PROPOSED", "UNDER_REVIEW", "APPROVED", "REJECTED", "SUPERSEDED"]
    }
  },
  "$defs": {
    "owner": {
      "enum": ["MI", "GEO_LEGACY", "GLOBAL_PASSPORT", "OFFER_REGISTRY", "LANGUAGE_LAYER", "RANKING_ENGINE", "RENDERER"],
      "description": "Owning system for a field. MI = Market Intelligence cell (canonical). GEO_LEGACY = existing frozen six-exchange GEO passport (read-only input)."
    }
  }
}
