{
  "bindingId": "bind-kz-mexc",
  "exchangeId": "mexc",
  "countryCode": "KZ",
  "canonicalRecord": "GEO_LEGACY",
  "miCellRef": "research/market-intelligence/staging/kz/mexc/p0b-v1/canonical-preview/exchange-market-cell.preview.json (PREVIEW; future canonical data/market-intelligence/cells/by-country/kz/mexc.json)",
  "legacyGeoPassportRef": "research/geo/kazakhstan/exchanges/mexc.json",
  "deepPassportRef": null,
  "migrationPhase": "MIGRATION_4",
  "ownership": {
    "exchangeIdentity": "GLOBAL_PASSPORT",
    "countryIdentity": "MI",
    "availability": "MI",
    "productStatuses": "MI",
    "registration": "MI",
    "kyc": "MI",
    "p2p": "MI",
    "localFiat": "MI",
    "fees": "MI",
    "restrictions": "MI",
    "evidence": "MI",
    "confidence": "MI",
    "freshness": "MI",
    "offerEligibility": "OFFER_REGISTRY",
    "rankingEligibility": "RANKING_ENGINE",
    "ctaEligibility": "MI",
    "languagePresentation": "LANGUAGE_LAYER"
  },
  "eligibility": {
    "availability": "RESTRICTED",
    "rankingEligibility": false,
    "ctaEligibility": false,
    "promoEligibility": false,
    "affiliateInfluencesRanking": false
  },
  "evidencePrecedence": [
    "REGULATOR_SANCTIONS",
    "EXCHANGE_TERMS_RESTRICTED_REGION",
    "OFFICIAL_PRODUCT_FEE",
    "BANKS_PAYMENT_RAILS",
    "NEWS",
    "COMMUNITY"
  ],
  "conflictResolution": {
    "case": "OFFICIAL_SOURCES_DISAGREE",
    "outcome": "OWNER_REVIEW_REQUIRED",
    "ctaSuppressed": true,
    "rankingSuppressed": true,
    "productionRouteUnchanged": true,
    "notes": "RECOVERED / UNVERIFIED; NOT_LIVE_VERIFIED. All 7 KZ x MEXC conflicts remain unresolved and owner-review-required: cf-kz-mexc-terms-vs-regulator, cf-kz-mexc-terms-vs-app-support, cf-kz-mexc-terms-vs-p2p-kzt, cf-kz-mexc-terms-vs-fiat-tn, cf-kz-mexc-terms-vs-earn, cf-kz-mexc-card-guide-scope, cf-kz-mexc-global-referral-vs-kz-restriction. Non-active PREVIEW only; existing GEO passport (research/geo/kazakhstan/exchanges/mexc.json) remains production truth; ranking and CTA suppressed; promo not eligible; production route unchanged."
  },
  "liveVerificationState": "NOT_LIVE_VERIFIED",
  "productionStable": true,
  "ownerApproved": false,
  "reviewStatus": "PROPOSED"
}
